{
  "schema_version": "1",
  "key": "acme.inventory",
  "slug": "inventory",
  "name": "Inventory",
  "version": "0.1.0",
  "publisher": { "id": "acme", "name": "Acme" },
  "trust": "builtin",
  "compatibility": { "platform": "^0.1", "sdk": "^0.1" },
  "dependencies": [
    { "module": "platform.core", "version": "^0.1", "optional": false },
    { "module": "acme.example", "version": "^1.0", "optional": false }
  ],
  "capabilities": ["inventory.items.read"],
  "migrations": { "strategy": "versioned" },
  "offline": { "mode": "online-only" }
}
