{
  "schema_version": "1",
  "key": "acme.slug-panjang",
  "slug": "abcdefghijklmnopqrstuvwxyzabcdefghijklmnopqrstuvwxy",
  "name": "Slug Terlalu Panjang",
  "version": "1.0.0",
  "publisher": { "id": "acme", "name": "Acme Inc" },
  "trust": "builtin",
  "compatibility": { "platform": "^0.1", "sdk": "^0.1" },
  "dependencies": [{ "module": "platform.core", "version": "^0.1", "optional": false }],
  "capabilities": [],
  "migrations": { "strategy": "versioned" },
  "offline": { "mode": "online-only" }
}
