{
  "schema_version": "1",
  "key": "acme.example",
  "slug": "example",
  "name": "Acme Example",
  "version": "1.0.0",
  "publisher": { "id": "acme", "name": "Acme Inc" },
  "trust": "untrusted",
  "compatibility": { "platform": "^0.1", "sdk": "^0.1" },
  "dependencies": [
    { "module": "platform.core", "version": "^0.1", "optional": false }
  ],
  "capabilities": ["example.read"],
  "migrations": { "strategy": "versioned" },
  "offline": { "mode": "online-only" }
}
