{
  "schema_version": "1",
  "key": "acme.example-addon",
  "slug": "example-addon",
  "name": "Example Add-on",
  "version": "1.0.0",
  "publisher": { "id": "acme", "name": "ACME" },
  "trust": "builtin",
  "compatibility": { "platform": "^0.1", "sdk": "^0.1" },
  "dependencies": [
    { "module": "platform.core", "version": "^0.1", "optional": false },
    { "module": "acme.example", "version": "^1.0", "optional": false }
  ],
  "capabilities": ["example-addon.summary.read"],
  "migrations": { "strategy": "none" },
  "offline": { "mode": "online-only" }
}
